{
  "schema_version": "0.2.0",
  "game_uid": "12345678-1234-4234-8234-123456789abc",
  "sub_game_number": 1,
  "events": [
    {
      "sequence": 1,
      "step_number": 1,
      "phase": "commit",
      "actor": "police",
      "commit_digest": "aaaaaaaaaaaaaaaaaaaaaaaaaaaaaaaaaaaaaaaaaaaaaaaaaaaaaaaaaaaaaaaa",
      "sealed": true
    }
  ],
  "audit": {"status": "pending", "verified_through_sequence": 0}
}
